{
  "artifact_refs": [
    "sha256:eeeeeeeeeeeeeeeeeeeeeeeeeeeeeeeeeeeeeeeeeeeeeeeeeeeeeeeeeeeeeeee"
  ],
  "assertion_id": "ast_01J00000000000000000000001",
  "confidence": 1.0,
  "contradiction_group": "con_01J00000000000000000000001",
  "created_at": "2026-08-12T12:00:00Z",
  "identity": {
    "id": "tgt_01J00000000000000000000001",
    "kind": "target",
    "version_hash": "sha256:dddddddddddddddddddddddddddddddddddddddddddddddddddddddddddddddd"
  },
  "integrity": {
    "algorithm": "sha256",
    "canonicalization": "rfc8785",
    "content_hash": "sha256:a002a966fe43ca7d55f18c0272762bddba00293236052a9e824ddaa901aedf0c",
    "excluded_fields": [
      "integrity.content_hash"
    ]
  },
  "namespace": "target",
  "object_kind": "identifier",
  "object_value": "nod_01J00000000000000000000002",
  "predicate": "has.asset.flow",
  "provenance": [
    {
      "license_or_terms": "private-test-fixture",
      "provenance_id": "prv_01J00000000000000000000001",
      "raw_hash": "sha256:bbbbbbbbbbbbbbbbbbbbbbbbbbbbbbbbbbbbbbbbbbbbbbbbbbbbbbbbbbbbbbbb",
      "retrieved_at": "2026-08-12T12:00:00Z",
      "source_uri": "https://fixtures.ayran.dev/m0",
      "source_version": "fixture-v1",
      "transformation_lineage": []
    }
  ],
  "run_id": "run_01J00000000000000000000001",
  "schema_version": "1.0.0",
  "source_version": "fixture-v1",
  "subject_id": "nod_01J00000000000000000000001",
  "supersedes": [
    "ast_01J00000000000000000000002"
  ],
  "trust_class": "deterministic_tool",
  "valid_from_event": "evt_01J00000000000000000000001",
  "valid_to_event": null,
  "writer": {
    "id": "ayran.fixture",
    "kind": "service",
    "version": "1.0.0"
  },
  "written_at": "2026-08-12T12:00:00Z"
}
